{
  "$schema": "../../schema/meta.schema.json",
  "name": "Example",
  "connector_type": "source",
  "version": "0.1.0",
  "release_stage": "alpha",
  "support_level": "community",
  "source_type": "api",
  "license": "MIT",
  "documentation_url": "https://github.com/synclet-io/synclet-connectors-template/tree/main/connectors/source-example",
  "icon_url": "",
  "language": "go",
  "tags": [
    "example"
  ],
  "breaking_changes": {},
  "external_documentation_urls": []
}
